{
  "schema_version": "mathgraph.capability-registry.v1",
  "id": "urn:mathgraph:capability-registry",
  "version": "1",
  "qualified_entries": [
    {
      "id": "urn:mathgraph:capability:finite-developmental-growth",
      "profile": "mathgraph.finite-representation-refinement.v1",
      "version": "1",
      "contract": {
        "id": "urn:mathgraph:capability:finite-developmental-growth",
        "locator": "conformance/capability_v1/fixtures/capability-contract.json",
        "media_type": "application/json",
        "sha256": "24e639b9181af313100504e0aa525536197d868810e6ffdb5093fd13501577a8",
        "size_bytes": 3533
      },
      "evaluation": {
        "id": "urn:mathgraph:evaluation:finite-refinement:v1",
        "locator": "conformance/capability_v1/evaluation.json",
        "sha256": "c1cf195917694f4402e6b3e41a174985d52fb57c5f0de99bd96a28ebf91d4312",
        "size_bytes": 1260,
        "media_type": "application/json"
      },
      "qualification_receipt": {
        "id": "urn:mathgraph:receipt:finite-refinement:v1",
        "locator": "conformance/capability_v1/receipt.json",
        "media_type": "application/json",
        "sha256": "2f07b700dfd2b75236ee399f77f4f288953b045af0eae55f4099a558278cb009",
        "size_bytes": 5260
      },
      "trust_policy": {
        "id": "urn:mathgraph:policy:finite-refinement:v1",
        "locator": "conformance/capability_v1/trust-policy.json",
        "media_type": "application/json",
        "sha256": "7069c764579d933679f6bfd9b922a724ad9bcb250e4060c660cb4fd099c60e89",
        "size_bytes": 1199
      }
    }
  ],
  "experimental_candidates": [
    {
      "id": "urn:mathgraph:capability:vdn-lean",
      "version": "1",
      "profile": "mathgraph.capability.vdn-lean.v1",
      "status": "EXPERIMENTAL",
      "description": "Lean capability evidence candidate. Requires pinned native replay and independent contract-to-declaration binding before admission.",
      "source": {
        "id": "urn:mathgraph:source:vdn-development-certificate",
        "locator": "verified-developmental-navigation/lean/VerifiedDevelopmentalNavigation/DevelopmentCertificate.lean",
        "sha256": "fc266183da8d7de2e5bc82b9eea093b64719fd9ef8f90f7c14e5bb3fe9b98a0a",
        "size_bytes": 2705,
        "media_type": "text/plain"
      }
    }
  ]
}
